{
	"$schema":	"http://json-schema.org/draft-07/schema#",
	"type":	"object",
	"properties":	{
		"extra":	{
			"type":	["object", "null"]
		},
		"id":	{
			"type":	["string", "number", "integer", "boolean", "object", "array"]
		},
		"name":	{
			"type":	"string"
		},
		"age":	{
			"type":	["string", "number", "integer", "boolean", "object", "array", "null"]
		},
		"active":	{
			"type":	["string", "number", "integer", "boolean", "object", "array", "null"]
		},
		"score":	{
			"type":	["string", "number", "integer", "boolean", "object", "array", "null"]
		}
	},
	"required":	["id", "name"]
}
