[
  {
    "id": 1,
    "name": "John Doe",
    "age": 30,
    "active": true,
    "score": 85.5
  },
  {
    "id": 2,
    "name": "Jane Smith",
    "age": "28",
    "active": false,
    "score": "92.3"
  },
  {
    "id": 3,
    "name": "Bob Johnson",
    "age": null,
    "active": true,
    "score": 78
  },
  {
    "id": "4",
    "name": "Alice Brown",
    "age": 24,
    "active": null,
    "score": null,
    "extra": {
      "department": "Marketing",
      "years": 2
    }
  }
]